Buy,NVDA,NVIDIA Corporation ,16.1311
Buy,AAP,Advance Auto Parts Inc Advance  ,19.7034
Buy,SCHW,Charles Schwab Corporation (The ,22.1283
Buy,JPM,JP Morgan Chase & Co. Common St ,23.4525
Buy,CHRW,C.H. Robinson Worldwide Inc. ,25.2507
Buy,CSCO,Cisco Systems Inc. ,26.8022
Buy,FOX,Twenty-First Century Fox Inc. ,27.2777
Buy,ORLY,O'Reilly Automotive Inc. ,27.2805
Buy,SYK,Stryker Corporation Common Stoc ,27.6099
Buy,ACN,Accenture plc. Class A Ordinary ,27.9178
Buy,CME,CME Group Inc. ,28.0621
Buy,BAC,Bank of America Corporation Com ,28.4762
Buy,QCOM,QUALCOMM Incorporated ,28.4964
Buy,BMY,Bristol-Myers Squibb Company Co ,28.5577
Buy,FDX,FedEx Corporation Common ,29.1063
Buy,GIS,General Mills Inc. Common Stoc ,29.5744
