ticker,name,sector,price_date, close_price, macd,stoch,RSI, dma_20_sd, bollinger
PBT,Permian Basin Royalty Trust Com ,Basic Materials,Independent Oil & Gas
VSBN,VSB Bancorp Inc. (NY) ,Financial,Regional - Northeast Banks
AIQ,Alliance HealthCare Services I ,Healthcare,Medical Laboratories & Research
ERS,Empire Resources Inc. ,Services,Basic Materials Wholesale
XLNX,Xilinx Inc. ,Technology,Semiconductor - Specialized
NSR,Neustar Inc. Neustar Inc. Cla ,Technology,Diversified Communication Services
