ticker,name,sector,price_date, close_price, macd,stoch,RSI, dma_20_sd, bollinger
AEM,Agnico-Eagle Mines Limited Comm ,Basic Materials,2016-02-11,35.33,0.559910774230957,80.8157,76.9125,2.53184,10.1273574829102
ATSG,Air Transport Services Group I ,Services,2016-02-11,11,0.322584867477417,84.5574,73.7855,0.485083,1.94033300876617
AUMN,Golden Minerals Co. Common Stoc ,Basic Materials,2016-02-11,0.3,0.0229112030938268,88.3117,76.6441,0.0348007,0.139202728867531
AXU,Alexco Resource Corp Common Sha ,Basic Materials,2016-02-11,0.59,0.0322424545884132,84.7653,78.4441,0.0792255,0.316902190446854
CEF,Central Fund of Canada Limited  ,Basic Materials,2016-02-11,12.29,0.188906073570251,91.8851,82.0875,0.599578,2.39831209182739
DXR,Daxor Corporation Common ,Healthcare,2016-02-11,8.47,0.128777369856834,59.0414,75.2037,0.214617,0.85846883058548
EDE,Empire District Electric Compan ,Utilities,2016-02-11,32.74,0.767298579216003,66.391,70.9546,1.54178,6.16711616516113
ELMD,Electromed Inc. Common ,Healthcare,2016-02-11,2.99,0.333384543657303,64.8715,76.5764,0.427928,1.7117121219635
GFI,Gold Fields Ltd. American Depos ,Basic Materials,2016-02-11,4.5,0.0943764448165894,86.874,73.6083,0.4798,1.91920185089111
GLUU,Glu Mobile Inc. ,Technology,2016-02-11,3.27,0.197790041565895,92.231,72.3272,0.342504,1.37001633644104
GSS,Golden Star Resources Ltd Comm ,Basic Materials,2016-02-11,0.32,0.0207771919667721,83.9634,77.6009,0.043808,0.175231844186783
KGC,Kinross Gold Corporation Common ,Basic Materials,2016-02-11,2.9,0.191390067338943,90.5764,80.7291,0.437635,1.75054109096527
MGH,Minco Gold Corporation Common S ,Basic Materials,2016-02-11,0.4,0.0502732768654823,76.8519,91.866,0.0572297,0.2289187759161
PCTI,PC-Tel Inc. ,Technology,2016-02-11,5.2,0.0751928687095642,88.7318,73.9911,0.192899,0.771594643592834
USEG,U.S. Energy Corp. ,Basic Materials,2016-02-11,0.43,0.034406416118145,92.3954,77.1566,0.0873351,0.349340230226517
VGZ,Vista Gold Corp New Common Stoc ,Basic Materials,2016-02-11,0.38,0.0142519026994705,74.0079,71.6842,0.0228785,0.0915139466524124
ASM, Avino Silver & Gold Mines Ltd.  ,Basic Materials,2016-02-11,1.05,0.0435131564736366,86.196,74.6031,0.105547,0.422186851501465
DBP, PowerShares DB Precious Metals  ,N/A,2016-02-11,37.59,0.473415732383728,91.4321,83.7685,1.34584,5.38337898254395
DBS, PowerShares DB Silver Fund ,N/A,2016-02-11,24.99,0.278008580207825,95.5748,71.5752,0.931363,3.72545051574707
DGL, PowerShares DB Gold Fund ,N/A,2016-02-11,40.67,0.538063406944275,93.3266,84.8888,1.45925,5.83700132369995
DGP, Deutsche Bank AG DB Gold Double ,N/A,2016-02-11,24.68,0.589905261993408,92.2139,84.8496,1.59008,6.36031913757324
FXY, Rydex CurrencyShares Japanese Y ,N/A,2016-02-11,86.21,0.843556642532349,92.6359,76.0295,1.58484,6.33936500549316
GJO, Synthetic Fixed-Income Securiti ,N/A,2016-02-11,20.49,0.107168406248093,45.912,71.0715,0.158523,0.634092688560486
GLD, SPDR Gold Trust ,N/A,2016-02-11,119.06,1.5653977394104,91.4859,84.5181,4.26193,17.047700881958
GLTR, ETFS Physical Precious Metal Ba ,N/A,2016-02-11,59.64,0.736671209335327,93.2688,80.4881,2.0599,8.23959827423096
IAG, Iamgold Corporation Ordinary Sh ,Basic Materials,2016-02-11,2.27,0.118748962879181,89.2834,74.8291,0.298932,1.19572806358337
IAU, ishares Gold Trust ,N/A,2016-02-11,12.03,0.159177601337433,91.5983,84.0384,0.432122,1.72848773002625
JJP, iPath DJ-UBS Precious Metals Su ,N/A,2016-02-11,57.39,0.928618431091309,82.6692,74.0712,2.31638,9.26552486419678
LD, iPath DJ-UBS Lead Subindex Tota ,N/A,2016-02-11,39.25,0.790724068880081,100,91.4088,0.932215,3.72886085510254
LSG, Lake Shore Gold Corp Ordinary S ,Basic Materials,2016-02-11,1.21,0.0401148498058319,83.1507,72.7259,0.125601,0.502403616905212
NUGT, Direxion Daily Gold Miners Bull ,N/A,2016-02-11,52.66,3.33891296386719,83.2149,75.3669,10.1495,40.5981063842773
PERM, Global X Permanent ETF ,N/A,2016-02-11,23.93,0.121123880147934,71.2755,70.3117,0.233172,0.93268620967865
PHYS, Sprott Physical Gold Trust ETV ,N/A,2016-02-11,10.24,0.140619993209839,90.3626,83.4662,0.368303,1.47321176528931
PPLT, ETFS Physical Platinum Shares ,N/A,2016-02-11,92.54,1.30306792259216,95.7701,73.5806,4.06046,16.2418479919434
PSLV, Sprott Physical Silver Trust ET ,N/A,2016-02-11,6.14,0.0848924219608307,89.1443,77.106,0.245631,0.982522368431091
PTM, E-TRACS USB Bloomberg Commodity ,N/A,2016-02-11,10.31,0.165029376745224,96.7377,72.7886,0.505753,2.02301096916199
RAND, Rand Capital Corporation ,Financial,2016-02-11,4.69,0.199342153966427,83.2463,77.1376,0.233475,0.933899521827698
SENEB, Seneca Foods Corp. ,Consumer Goods,2016-02-11,44.88,3.00226950645447,100,96.7396,3.69555,14.7821950912476
SGOL, ETFS Physical Swiss Gold Shares ,N/A,2016-02-11,121.47,1.59892463684082,92.4487,84.8539,4.36886,17.4754371643066
SIVR, ETFS Physical Silver Shares Tru ,N/A,2016-02-11,15.51,0.193032383918762,92.3064,75.8869,0.552204,2.20881772041321
SLV, iShares Silver Trust ,N/A,2016-02-11,14.95,0.164954721927643,88.9514,75.3106,0.513142,2.05256748199463
TGD, Timmins Gold Corp Common Shares ,Basic Materials,2016-02-11,0.22,0.0149601399898529,86.8557,76.5248,0.037056,0.148224145174026
UBG, E-TRACS USB Bloomberg Commodity ,N/A,2016-02-11,32.22,0.632572412490845,95.6324,87.7988,1.17147,4.68589925765991
UGLD, VelocityShares 3x Long Gold ETN ,N/A,2016-02-11,11.75,0.419731378555298,90.8234,85.6671,1.05733,4.22932529449463
USLV, VelocityShares 3x Long Silver E ,N/A,2016-02-11,14.03,0.431776523590088,88.0942,74.6373,1.22922,4.91688346862793
WDTI, WisdomTree Managed Futures Stra ,N/A,2016-02-11,43.01,0.254405170679092,89.977,73.1648,0.398267,1.59306871891022
WITE, ETFS White Metals Basket Trust ,N/A,2016-02-11,28.7,0.37565290927887,93.8342,73.7654,1.00414,4.01657056808472
RING,iShares MSCI Global Gold Miners Fund ETF,Global Equity ETF,2016-02-11,7.78,0.201094925403595,86.9691,78.4046,0.76003,3.04011821746826
ISHG,iShares S&P/Citigroup 1-3 Year International Treasury Bond Fund ETF,Fixed Income ETF,2016-02-11,81.18,0.421537637710571,95.2392,73.2459,1.1486,4.59441375732422
GDXJ,Market Vectors Junior Gold Miners ETF,Global Equity ETF,2016-02-11,24.01,0.651564359664917,85.8109,72.8243,1.99646,7.98584318161011
GDX,Market Vectors TR Gold Miners ETF,US Equity ETF,2016-02-11,18.37,0.480899930000305,87.2399,74.4198,1.74368,6.97473955154419
PSAU,PowerShares Global Gold and Precious Metals Portfolio ETF,Global Equity ETF,2016-02-11,15.67,0.373703956604004,87.6722,75.7824,1.44446,5.77784299850464
UGL,ProShares Ultra Gold ETF,Commodity Based ETF,2016-02-11,40.75,1.02579641342163,92.1345,85.8331,2.66724,10.6689720153809
AGQ,ProShares Ultra Silver ETF,Commodity Based ETF,2016-02-11,34.45,0.721485137939453,87.7442,73.5685,2.11984,8.4793529510498
YCL,ProShares Ultra Yen ETF,Commodity Based ETF,2016-02-11,62.47,1.17352032661438,93.7949,75.8463,2.1734,8.69358730316162
BWZ,SPDR Barclays Capital Short Term International Treasury Bond ETF,Fixed Income ETF,2016-02-11,30.65,0.134233772754669,92.769,74.9225,0.387317,1.54926764965057
BCRH,Blue Capital Reinsurance Holdings Ltd. ,N/A,2016-02-11,19,0.205238103866577,91.6485,74.675,0.542458,2.16983032226562
AKG,Asanko Gold Inc. ,Basic Materials,2016-02-11,1.85,0.0581559538841248,80.1179,71.4463,0.164459,0.657834053039551
ERO,iPath EUR/USD Exchange Rate ETN ,N/A,2016-02-11,42.9,0.30967503786087,85.7881,77.1284,0.700662,2.80264782905579
GEUR,AdvisorShares Gartman Gold/Euro ETF ,N/A,2016-02-11,12.74,0.122688949108124,78.2461,71.0289,0.321636,1.28654587268829
JNUG,Direxion Daily Jr Gld Mnrs Bull 3X Shrs ,N/A,2016-02-11,55.35,3.57764148712158,82.2226,72.5718,9.74283,38.971321105957
USFR,WisdomTree Bloomberg Floating Rt Trs ,N/A,2016-02-11,24.95,0.038628195412457,64.3567,86.2399,0.0600176,0.240070343017578
LDRI,PowerShares LadderRite 0-5 Year ,,2016-02-11,25.91,0.22712355107069,67.8212,83.5237,0.275528,1.10211062431335
NMS,Nuveen Minnesota Municipal Inco,N/A,2016-02-11,15.7,0.139429330825806,91.8013,86.9428,0.362461,1.44984340667725
OUNZ,Merk Gold Trust ETV ,,2016-02-11,12.35,0.159961342811584,94.241,85.4453,0.442732,1.7709299325943
GDXX,ProShares Ultra Gold Miners ETF,,2016-02-11,36.2,1.61041593551636,85.2066,75.6112,5.59587,22.3834819793701
GDJJ,ProShares Ultra Junior Miners,,2016-02-11,38.33,1.72519159317017,86.0269,75.1902,5.40137,21.6054649353027
PGLC,Pershing Gold Corporation,Basic Materials,2016-02-11,4.6,0.204573839902878,77.2178,79.6872,0.379227,1.51690602302551
AGM-A,Federal Agricultural Mortgage Corp.,N/A,2016-02-11,29.45,0.584911286830902,96.337,83.2388,0.867818,3.471271276474
