Buy,AMGN,Amgen Inc. ,19.7232
Buy,AMP,Ameriprise Financial Inc. Comm ,2.02011
Buy,AON,Aon plc Class A Ordinary Shares ,19.1928
Buy,APA,Apache Corporation Common ,12.1695
Buy,APC,Anadarko Petroleum Corporation  ,18.4635
Buy,APD,Air Products and Chemicals Inc ,7.76618
Buy,APH,Amphenol Corporation Common Sto ,1.55308
Buy,AVY,Avery Dennison Corporation Comm ,14.6861
Buy,AYI,Acuity Brands Inc (Holding Comp ,1.15248
Buy,AZO,AutoZone Inc. Common ,6.89516
Buy,CERN,Cerner Corporation ,15.8734
Buy,CF,CF Industries Holdings Inc. Co ,14.6755
Buy,CHD,Church & Dwight Company Inc. C ,15.354
Buy,CLX,Clorox Company (The) Common Sto ,17.1325
Buy,CMA,Comerica Incorporated Common St ,11.7181
Buy,CME,CME Group Inc. ,7.45656
Buy,CMI,Cummins Inc. Common ,9.7353
Buy,COF,Capital One Financial Corporati ,14.352
Buy,CTSH,Cognizant Technology Solutions  ,10.4856
Buy,CVX,Chevron Corporation Common Stoc ,8.52775
Buy,DD,E.I. du Pont de Nemours and Com ,17.7285
Buy,DFS,Discover Financial Services Com ,9.4572
Buy,DG,Dollar General Corporation Comm ,4.05435
Buy,DIS,Walt Disney Company (The) Commo ,3.15672
Buy,DOV,Dover Corporation Common ,8.3387
Buy,DVA,DaVita Inc. Common ,11.3485
Buy,EFX,Equifax Inc. Common ,7.68457
Buy,EMN,Eastman Chemical Company Common ,19.1539
Buy,EMR,Emerson Electric Company Common ,15.5255
Buy,EQT,EQT Corporation Common ,2.00182
Buy,GD,General Dynamics Corporation Co ,13.4139
Buy,GILD,Gilead Sciences Inc. ,6.58138
Buy,GPC,Genuine Parts Company Common St ,8.64775
Buy,GRMN,Garmin Ltd. ,5.84136
Buy,GS,Goldman Sachs Group Inc. (The) ,6.90272
Buy,GT,Goodyear Tire & Rubber Company  ,2.26184
Buy,INCY,Incyte Corporation ,11.2496
Buy,INTC,Intel Corporation ,12.1981
Buy,IP,International Paper Company Com ,17.3435
Buy,IPG,Interpublic Group of Companies ,10.957
Buy,IR,Ingersoll-Rand plc (Ireland) ,6.8669
Buy,IRM,Iron Mountain Incorporated (Del ,16.0495
Buy,ISRG,Intuitive Surgical Inc. ,17.262
Buy,IT,Gartner Inc. Common ,11.8515
Buy,ITW,Illinois Tool Works Inc. Common ,2.22215
Buy,IVZ,Invesco Plc New Common ,6.73137
Buy,LOW,Lowe's Companies Inc. Common S ,18.4119
Buy,LUK,Leucadia National Corporation C ,18.1087
Buy,LUV,Southwest Airlines Company Comm ,19.1553
Buy,LVLT,Level 3 Communications Inc. Co ,10.7803
Buy,LYB,LyondellBasell Industries NV Or ,10.3179
Buy,MAS,Masco Corporation Common ,13.3811
Buy,MET,MetLife Inc. Common ,2.24134
Buy,MHK,Mohawk Industries Inc. Common  ,8.00784
Buy,MLM,Martin Marietta Materials Inc. ,13.5914
Buy,NUE,Nucor Corporation Common ,15.9289
Buy,NWSA,News Corporation ,2.22226
Buy,OMC,Omnicom Group Inc. Common ,11.9505
Buy,PBCT,People's United Financial Inc. ,15.1838
Buy,PCAR,PACCAR Inc. ,17.074
Buy,PFG,Principal Financial Group Inc C ,17.7461
Buy,PG,Procter & Gamble Company (The)  ,19.8081
Buy,RIG,Transocean Ltd (Switzerland) Co ,6.06071
Buy,RJF,Raymond James Financial Inc. C ,1.86693
Buy,ROK,Rockwell Automation Inc. Commo ,10.704
Buy,ROP,Roper Industries Inc. Common S ,17.4421
Buy,ROST,Ross Stores Inc. ,7.75396
Buy,RTN,Raytheon Company Common ,12.4632
Buy,SHW,Sherwin-Williams Company (The)  ,15.8681
Buy,SIG,Signet Jewelers Limited Common  ,10.4135
Buy,SJM,J.M. Smucker Company (The) New  ,11.5311
Buy,SLG,SL Green Realty Corporation Com ,8.18643
Buy,SNPS,Synopsys Inc. ,12.6703
Buy,WHR,Whirlpool Corporation Common St ,12.4444
Buy,WYN,Wyndham Worldwide Corp Common   ,7.77781
Buy,XLNX,Xilinx Inc. ,13.3551
Buy,XOM,Exxon Mobil Corporation Common  ,15.7697
Buy,ZION,Zions Bancorporation ,14.439
Buy,DLPH, Delphi Automotive plc Ordinary  ,12.4416
Buy,ETN, Eaton Corporation Common ,3.25189
Buy,FBHS, Fortune Brands Home & Security  ,6.66669
Buy,FITB, Fifth Third Bancorp ,9.72198
Buy,GWW, W.W. Grainger  Inc. Common Stoc ,14.7408
Buy,HAS, Hasbro  Inc. ,9.45497
Buy,HBAN, Huntington Bancshares Incorpora ,7.77793
Buy,HBI, Hanesbrands Inc. Common ,10.4782
Buy,HCA, HCA Holdings  Inc. Common ,7.73967
Buy,HD, Home Depot  Inc. (The) Common S ,19.8117
Buy,HIG, Hartford Financial Services Gro ,17.1054
Buy,HON, Honeywell International Inc. Co ,19.9999
Buy,QRVO,Qorvo Inc.,17.0866
Buy,WRK,WestRock Company,8.10552
Buy,ZBH,Zimmer Biomet Holdings  Inc.,13.5618
Buy,CSRA,CSRA Inc.,15.1333
Buy,FTV,Fortive Corporation,10.42
Buy,ARNC,Arconic Inc.,9.38818
Sell,ARE,Alexandria Real Estate Equities ,98.7301
Sell,AWK,American Water Works Company I ,92.0132
Sell,D,Dominion Resources Inc. Common ,87.1227
Sell,DPS,Dr Pepper Snapple Group Inc Dr ,80.264
Sell,DUK,Duke Energy Corporation (Holdin ,85.471
Sell,EIX,Edison International Common Sto ,81.2142
Sell,EQR,Equity Residential Common Share ,91.4818
Sell,GGP,General Growth Properties Inc. ,83.9936
Sell,LNT,Alliant Energy Corporation Comm ,82.5918
Sell,MAA,Mid-America Apartment Communiti ,93.5432
Sell,NTAP,NetApp Inc. ,93.7197
Sell,PEP,Pepsico Inc. Common ,83.0205
Sell,RSG,Republic Services Inc. Common  ,94.0039
Sell,SCG,SCANA Corporation Common ,84.4452
Sell,SO,Southern Company (The) Common S ,84.2184
Sell,WM,Waste Management Inc. Common S ,91.2403
Sell,WY,Weyerhaeuser Company Common Sto ,87.0373
Sell,XEL,Xcel Energy Inc. Common ,81.8375
Sell,HCN, Health Care REIT  Inc. Common S ,80.8768
Sell,HOG, Harley-Davidson  Inc. Common St ,84.0684
Sell,SPGI,S&P Global  Inc.,94.335
Sell,UAA,Under Armour  Inc. Class A,87.5198
