Buy,ARE,Alexandria Real Estate Equities ,7.39573
Buy,AVB,AvalonBay Communities Inc. Com ,6.18762
Buy,CNP,CenterPoint Energy Inc (Holdin ,3.42972
Buy,COH,Coach Inc. Common ,6.06071
Buy,D,Dominion Resources Inc. Common ,11.3117
Buy,DAL,Delta Air Lines Inc. (New) Comm ,17.5887
Buy,DGX,Quest Diagnostics Incorporated  ,3.94279
Buy,DIS,Walt Disney Company (The) Commo ,12.2582
Buy,DISH,DISH Network Corporation ,2.16742
Buy,DOV,Dover Corporation Common ,6.56624
Buy,DPS,Dr Pepper Snapple Group Inc Dr ,6.25043
Buy,DRI,Darden Restaurants Inc. Common ,15.7662
Buy,DVA,DaVita Inc. Common ,13.1959
Buy,EL,Estee Lauder Companies Inc. (T ,17.1943
Buy,EQR,Equity Residential Common Share ,4.34869
Buy,FDX,FedEx Corporation Common ,3.73022
Buy,FIS,Fidelity National Information S ,3.70441
Buy,FISV,Fiserv Inc. ,13.0341
Buy,FLIR,FLIR Systems Inc. ,14.1204
Buy,FRT,Federal Realty Investment Trust ,1.29209
Buy,GD,General Dynamics Corporation Co ,11.4479
Buy,GE,General Electric Company Common ,8.02498
Buy,GM,General Motors Company Common S ,11.9746
Buy,GOOG,Alphabet Inc.,6.85198
Buy,GS,Goldman Sachs Group Inc. (The) ,16.9878
Buy,IR,Ingersoll-Rand plc (Ireland) ,4.49832
Buy,IRM,Iron Mountain Incorporated (Del ,6.94398
Buy,ITW,Illinois Tool Works Inc. Common ,5.34194
Buy,IVZ,Invesco Plc New Common ,4.44535
Buy,KIM,Kimco Realty Corporation Common ,8.73016
Buy,KSS,Kohl's Corporation Common ,4.50361
Buy,MCO,Moody's Corporation Common Stoc ,5.23716
Buy,MKC,McCormick & Company Incorporat ,16.049
Buy,MTD,Mettler-Toledo International I ,2.93101
Buy,NDAQ,The NASDAQ OMX Group Inc. ,2.84332
Buy,NEE,NextEra Energy Inc. Common Sto ,13.9423
Buy,NKE,Nike Inc. Common ,6.28387
Buy,NSC,Norfolk Southern Corporation Co ,17.6398
Buy,NTAP,NetApp Inc. ,11.2538
Buy,NVDA,NVIDIA Corporation ,15.3052
Buy,NWL,Newell Rubbermaid Inc. Common S ,13.1783
Buy,O,Realty Income Corporation Commo ,2.46872
Buy,PBCT,People's United Financial Inc. ,7.40647
Buy,RSG,Republic Services Inc. Common  ,17.6628
Buy,SCG,SCANA Corporation Common ,12.5356
Buy,SNPS,Synopsys Inc. ,1.85221
Buy,ETN, Eaton Corporation Common ,4.79893
Buy,FBHS, Fortune Brands Home & Security  ,15.3128
Buy,FITB, Fifth Third Bancorp ,12.2249
Buy,HBI, Hanesbrands Inc. Common ,3.67003
Buy,HCA, HCA Holdings  Inc. Common ,19.7523
Buy,HIG, Hartford Financial Services Gro ,9.30512
Buy,HRB, H&R Block  Inc. Common ,14.3776
Buy,MDLZ, Mondelez International  Inc. ,15.5745
Buy,MPC, Marathon Petroleum Corporation  ,16.667
Buy,WFM, Whole Foods Market  Inc. ,17.4081
Buy,XYL, Xylem Inc. Common ,15.2183
Buy,SPY,SPDR S&P 500 ETF,18.6686
Buy,AAL,American Airlines Group Inc. ,6.29679
Buy,FOX,Twenty-First Century Fox Inc. ,19.5243
Buy,ALLE,Allegion plc Ordinary Shares ,17.1286
Buy,GOOGL,Alphabet Inc.,4.80453
Buy,NAVI,Navient Corporation ,3.87921
Buy,QRVO,Qorvo Inc.,2.96289
Buy,PYPL,PayPal Holdings  Inc.,11.7793
Buy,ZBH,Zimmer Biomet Holdings  Inc.,6.78967
Buy,FTV,Fortive Corporation,13.8888
Buy,ARNC,Arconic Inc.,7.94051
Buy,UAA,Under Armour  Inc. Class A,6.17297
Sell,AMP,Ameriprise Financial Inc. Comm ,82.3746
Sell,AMT,American Tower Corporation (REI ,97.7259
Sell,AN,AutoNation Inc. Common ,97.5303
Sell,AON,Aon plc Class A Ordinary Shares ,93.6476
Sell,APA,Apache Corporation Common ,87.2098
Sell,APC,Anadarko Petroleum Corporation  ,91.3643
Sell,APH,Amphenol Corporation Common Sto ,87.4065
Sell,AXP,American Express Company Common ,95.0353
Sell,COF,Capital One Financial Corporati ,96.5597
Sell,COG,Cabot Oil & Gas Corporation Com ,87.7495
Sell,CTL,CenturyLink Inc. Common ,84.6979
Sell,DFS,Discover Financial Services Com ,96.2964
Sell,DHR,Danaher Corporation Common Stoc ,94.094
Sell,DOW,Dow Chemical Company (The) Comm ,82.8979
Sell,FAST,Fastenal Company ,80.033
Sell,FE,FirstEnergy Corporation Common  ,83.7977
Sell,FLR,Fluor Corporation Common ,82.0462
Sell,GIS,General Mills Inc. Common Stoc ,98.6108
Sell,GPN,Global Payments Inc. Common Sto ,97.9801
Sell,GT,Goodyear Tire & Rubber Company  ,81.4791
Sell,KMX,CarMax Inc ,94.9815
Sell,LB,L.B. Foster Company ,83.3855
Sell,LEN,Lennar Corporation Class A Comm ,96.7375
Sell,LMT,Lockheed Martin Corporation Com ,91.9411
Sell,LNC,Lincoln National Corporation Co ,88.0352
Sell,MET,MetLife Inc. Common ,82.214
Sell,MOS,Mosaic Company (The) Common Sto ,95.6345
Sell,MRK,Merck & Company Inc. Common St ,95.0892
Sell,MRO,Marathon Oil Corporation Common ,83.8388
Sell,MUR,Murphy Oil Corporation Common S ,86.9972
Sell,MYL,Mylan Inc. ,86.5989
Sell,NBL,Noble Energy Inc. Common ,89.9116
Sell,NRG,NRG Energy Inc. Common ,92.0298
Sell,OMC,Omnicom Group Inc. Common ,81.5556
Sell,PCG,Pacific Gas & Electric Co. Comm ,87.0368
Sell,PFG,Principal Financial Group Inc C ,80.7314
Sell,PG,Procter & Gamble Company (The)  ,81.2225
Sell,REGN,Regeneron Pharmaceuticals Inc. ,90.9677
Sell,RHI,Robert Half International Inc.  ,97.2222
Sell,RHT,Red Hat Inc. Common ,81.0253
Sell,RTN,Raytheon Company Common ,83.1757
Sell,SHW,Sherwin-Williams Company (The)  ,96.6804
Sell,BLK,BlackRock Inc,87.1717
Sell,HAL, Halliburton Company Common Stoc ,88.8893
Sell,HD, Home Depot  Inc. (The) Common S ,87.8106
Sell,HON, Honeywell International Inc. Co ,83.3022
Sell,HPQ, Hewlett-Packard Company Common  ,92.6584
Sell,LLY, Eli Lilly and Company Common St ,81.0825
Sell,MNK,Mallinckrodt plc ,95.6581
