Buy,AIG,American International Group I ,5.22798
Buy,ALB,Albemarle Corporation Common St ,16.2262
Buy,AME,AMETEK Inc. ,9.15804
Buy,AMG,Affiliated Managers Group Inc. ,14.9461
Buy,AMZN,Amazon.com Inc. ,15.5223
Buy,APA,Apache Corporation Common ,16.8686
Buy,APH,Amphenol Corporation Common Sto ,7.84273
Buy,AVGO,Avago Technologies Limited ,5.77867
Buy,AWK,American Water Works Company I ,17.7631
Buy,AXP,American Express Company Common ,18.7491
Buy,BBY,Best Buy Co. Inc. Common ,7.8565
Buy,BHGE,Baker Hughes Incorporated Commo ,15.3525
Buy,BIIB,Biogen Idec Inc. ,5.69186
Buy,BK,Bank of New York Mellon Corpora ,8.561
Buy,BMY,Bristol-Myers Squibb Company Co ,11.2949
Buy,BWA,BorgWarner Inc. Common ,12.6399
Buy,BXP,Boston Properties Inc. Common  ,3.92177
Buy,C,Citigroup Inc. Common ,11.0815
Buy,CAG,ConAgra Foods Inc. Common Stoc ,5.10819
Buy,CB,Chubb Corporation (The) Common  ,19.1204
Buy,CBG,CBRE Group Inc Common ,2.50397
Buy,CBOE,CBOE Holdings Inc. ,16.2225
Buy,CCL,Carnival Corporation Common Sto ,12.487
Buy,CERN,Cerner Corporation ,9.28591
Buy,CHRW,C.H. Robinson Worldwide Inc. ,16.0038
Buy,CME,CME Group Inc. ,10.784
Buy,CMI,Cummins Inc. Common ,18.2199
Buy,CNC,Centene Corporation Common Stoc ,11.1117
Buy,COF,Capital One Financial Corporati ,4.99733
Buy,COG,Cabot Oil & Gas Corporation Com ,19.3119
Buy,EFX,Equifax Inc. Common ,2.72334
Buy,EIX,Edison International Common Sto ,17.7817
Buy,EMN,Eastman Chemical Company Common ,18.4765
Buy,EQIX,Equinix Inc. ,5.67908
Buy,GE,General Electric Company Common ,14.0453
Buy,GPC,Genuine Parts Company Common St ,8.37066
Buy,GS,Goldman Sachs Group Inc. (The) ,11.1706
Buy,INCY,Incyte Corporation ,17.2071
Buy,IP,International Paper Company Com ,17.9741
Buy,IPG,Interpublic Group of Companies ,3.83577
Buy,IRM,Iron Mountain Incorporated (Del ,5.85522
Buy,ISRG,Intuitive Surgical Inc. ,16.4447
Buy,ITW,Illinois Tool Works Inc. Common ,3.05046
Buy,IVZ,Invesco Plc New Common ,9.25905
Buy,LNC,Lincoln National Corporation Co ,17.8099
Buy,LOW,Lowe's Companies Inc. Common S ,8.97108
Buy,LUV,Southwest Airlines Company Comm ,7.86523
Buy,LVLT,Level 3 Communications Inc. Co ,13.1217
Buy,LYB,LyondellBasell Industries NV Or ,19.237
Buy,M,Macy's Inc Common ,19.1532
Buy,MAR,Marriot International Common St ,19.4485
Buy,MAS,Masco Corporation Common ,9.21408
Buy,MAT,Mattel Inc. ,16.4525
Buy,MET,MetLife Inc. Common ,7.77674
Buy,MHK,Mohawk Industries Inc. Common  ,13.5267
Buy,NWL,Newell Rubbermaid Inc. Common S ,6.50482
Buy,O,Realty Income Corporation Commo ,16.2038
Buy,OMC,Omnicom Group Inc. Common ,15.4723
Buy,ORLY,O'Reilly Automotive Inc. ,12.5554
Buy,PAYX,Paychex Inc. ,14.4802
Buy,PCAR,PACCAR Inc. ,6.7214
Buy,PDCO,Patterson Companies Inc. ,3.83725
Buy,PFE,Pfizer Inc. Common ,10.0847
Buy,PFG,Principal Financial Group Inc C ,11.7345
Buy,RCL,Royal Caribbean Cruises Ltd. Co ,1.70944
Buy,RHI,Robert Half International Inc.  ,4.76214
Buy,RJF,Raymond James Financial Inc. C ,13.3137
Buy,ROK,Rockwell Automation Inc. Commo ,9.62512
Buy,ROST,Ross Stores Inc. ,16.164
Buy,SCHW,Charles Schwab Corporation (The ,7.22664
Buy,SHW,Sherwin-Williams Company (The)  ,17.4813
Buy,SIG,Signet Jewelers Limited Common  ,6.7126
Buy,SLG,SL Green Realty Corporation Com ,13.5611
Buy,SNA,Snap-On Incorporated Common Sto ,18.261
Buy,SNPS,Synopsys Inc. ,1.46915
Buy,SO,Southern Company (The) Common S ,11.9254
Buy,SPG,Simon Property Group Inc. Comm ,16.908
Buy,XL,XL Group plc ,19.6875
Buy,XRAY,DENTSPLY International Inc. ,7.97817
Buy,XRX,Xerox Corporation Common ,15.1946
Buy,BLK,BlackRock Inc,3.23119
Buy,BRK-B,Berkshire Hathaway Inc.,13.0155
Buy,DLPH, Delphi Automotive plc Ordinary  ,5.79725
Buy,EA, Electronic Arts Inc. ,19.3009
Buy,ETN, Eaton Corporation Common ,9.00441
Buy,GWW, W.W. Grainger  Inc. Common Stoc ,6.93988
Buy,HAL, Halliburton Company Common Stoc ,17.9655
Buy,HAS, Hasbro  Inc. ,10.7463
Buy,HBI, Hanesbrands Inc. Common ,14.0875
Buy,HIG, Hartford Financial Services Gro ,14.7683
Buy,HON, Honeywell International Inc. Co ,19.6224
Buy,HPQ, Hewlett-Packard Company Common  ,15.555
Buy,HRB, H&R Block  Inc. Common ,1.13234
Buy,SYF,Synchrony Financial Common Stoc,8.03151
Buy,QRVO,Qorvo Inc.,1.18125
Buy,WBA,Walgreens Boots Alliance Inc.,15.2243
Buy,KHC,The Kraft Heinz Company,14.8691
Buy,PYPL,PayPal Holdings  Inc.,12.6953
Buy,ZBH,Zimmer Biomet Holdings  Inc.,19.3334
Buy,HPE,Hewlett Packard Enterprise Company,7.15327
Buy,FTV,Fortive Corporation,5.07939
Sell,BSX,Boston Scientific Corporation C ,82.5398
Sell,CBS,CBS Corporation Class B Common  ,92.4504
Sell,DVN,Devon Energy Corporation Common ,83.5452
Sell,EQT,EQT Corporation Common ,93.585
Sell,MAA,Mid-America Apartment Communiti ,82.0441
Sell,RIG,Transocean Ltd (Switzerland) Co ,81.6667
Sell,RRC,Range Resources Corporation Com ,85.1968
Sell,RTN,Raytheon Company Common ,86.7363
Sell,YUM,Yum! Brands Inc. ,89.4589
Sell,HES, Hess Corporation Common ,80.8428
