Buy,AN,AutoNation Inc. Common ,12.2508
Buy,APA,Apache Corporation Common ,16.3398
Buy,AVB,AvalonBay Communities Inc. Com ,10.458
Buy,AVY,Avery Dennison Corporation Comm ,6.40146
Buy,AWK,American Water Works Company I ,4.10014
Buy,AZO,AutoZone Inc. Common ,2.68117
Buy,CBS,CBS Corporation Class B Common  ,8.79551
Buy,CL,Colgate-Palmolive Company Commo ,2.69642
Buy,CLX,Clorox Company (The) Common Sto ,4.63639
Buy,CME,CME Group Inc. ,16.6618
Buy,CMG,Chipotle Mexican Grill Inc. Co ,2.50406
Buy,CNP,CenterPoint Energy Inc (Holdin ,16.6659
Buy,D,Dominion Resources Inc. Common ,9.52286
Buy,DGX,Quest Diagnostics Incorporated  ,17.9484
Buy,DHI,D.R. Horton Inc. Common ,11.2531
Buy,DLR,Digital Realty Trust Inc. Comm ,10.9395
Buy,DOV,Dover Corporation Common ,4.30001
Buy,DPS,Dr Pepper Snapple Group Inc Dr ,2.50802
Buy,DRI,Darden Restaurants Inc. Common ,4.44534
Buy,DTE,DTE Energy Company Common ,1.67544
Buy,DUK,Duke Energy Corporation (Holdin ,17.4284
Buy,DVA,DaVita Inc. Common ,19.4629
Buy,ED,Consolidated Edison Inc. Commo ,5.55427
Buy,EIX,Edison International Common Sto ,4.16632
Buy,EMR,Emerson Electric Company Common ,17.4074
Buy,EXPD,Expeditors International of Was ,7.09878
Buy,EXR,Extra Space Storage Inc Common  ,5.52478
Buy,FAST,Fastenal Company ,5.73564
Buy,FDX,FedEx Corporation Common ,19.9694
Buy,FE,FirstEnergy Corporation Common  ,14.5021
Buy,FISV,Fiserv Inc. ,14.5121
Buy,FL,Footlocker Inc. ,10.9822
Buy,FRT,Federal Realty Investment Trust ,1.30255
Buy,GE,General Electric Company Common ,8.45714
Buy,GGP,General Growth Properties Inc. ,1.54312
Buy,GPC,Genuine Parts Company Common St ,1.88539
Buy,GPN,Global Payments Inc. Common Sto ,7.10017
Buy,GPS,Gap Inc. (The) Common ,4.55689
Buy,IP,International Paper Company Com ,2.0975
Buy,IPG,Interpublic Group of Companies ,6.57424
Buy,IR,Ingersoll-Rand plc (Ireland) ,8.59548
Buy,IVZ,Invesco Plc New Common ,12.8446
Buy,M,Macy's Inc Common ,5.91153
Buy,MAA,Mid-America Apartment Communiti ,6.75311
Buy,MAR,Marriot International Common St ,11.5066
Buy,NSC,Norfolk Southern Corporation Co ,12.6434
Buy,ORLY,O'Reilly Automotive Inc. ,5.57932
Buy,PAYX,Paychex Inc. ,2.42931
Buy,PCAR,PACCAR Inc. ,5.85968
Buy,PCG,Pacific Gas & Electric Co. Comm ,3.70333
Buy,PDCO,Patterson Companies Inc. ,12.4803
Buy,PEP,Pepsico Inc. Common ,4.98101
Buy,PG,Procter & Gamble Company (The)  ,2.27596
Buy,PXD,Pioneer Natural Resources Compa ,18.1825
Buy,RHI,Robert Half International Inc.  ,12.0906
Buy,RIG,Transocean Ltd (Switzerland) Co ,8.14831
Buy,ROK,Rockwell Automation Inc. Commo ,5.25567
Buy,ROST,Ross Stores Inc. ,3.2407
Buy,RRC,Range Resources Corporation Com ,15.3851
Buy,RSG,Republic Services Inc. Common  ,17.9705
Buy,SBUX,Starbucks Corporation ,5.46164
Buy,SCG,SCANA Corporation Common ,13.7843
Buy,SIG,Signet Jewelers Limited Common  ,2.1525
Buy,SLG,SL Green Realty Corporation Com ,11.8686
Buy,SNA,Snap-On Incorporated Common Sto ,2.3238
Buy,SPG,Simon Property Group Inc. Comm ,1.29952
Buy,DLPH, Delphi Automotive plc Ordinary  ,15.9964
Buy,FBHS, Fortune Brands Home & Security  ,4.03932
Buy,HAL, Halliburton Company Common Stoc ,9.19807
Buy,HAS, Hasbro  Inc. ,5.33945
Buy,HCN, Health Care REIT  Inc. Common S ,1.93907
Buy,HCP, HCP  Inc. Common ,1.38892
Buy,HOG, Harley-Davidson  Inc. Common St ,11.572
Buy,HON, Honeywell International Inc. Co ,17.6346
Buy,EVHC,Envision Healthcare Holdings Inc. ,15.4692
Buy,NAVI,Navient Corporation ,16.5124
Buy,SYF,Synchrony Financial Common Stoc,11.1114
Buy,WLTW,Willis Towers Watson Public Limited Company,3.05275
Buy,FTV,Fortive Corporation,11.2576
Sell,AMT,American Tower Corporation (REI ,93.3336
Sell,AMZN,Amazon.com Inc. ,96.5676
Sell,APH,Amphenol Corporation Common Sto ,87.6548
Sell,ATVI,Activision Blizzard Inc ,95.5172
Sell,AVGO,Avago Technologies Limited ,98.6398
Sell,CMA,Comerica Incorporated Common St ,89.6218
Sell,CTSH,Cognizant Technology Solutions  ,96.1211
Sell,CVS,CVS Caremark Corporation Common ,85.014
Sell,CVX,Chevron Corporation Common Stoc ,84.4467
Sell,DISCA,Discovery Communications Inc ,93.3508
Sell,DISCK,Discovery Communications Inc ,87.3947
Sell,EBAY,eBay Inc. ,94.8805
Sell,FFIV,F5 Networks Inc. ,82.2053
Sell,FIS,Fidelity National Information S ,81.8343
Sell,GOOG,Alphabet Inc.,86.2682
Sell,GS,Goldman Sachs Group Inc. (The) ,85.4602
Sell,MA,Mastercard Incorporated Common  ,86.538
Sell,NOC,Northrop Grumman Corporation Co ,81.6615
Sell,NVDA,NVIDIA Corporation ,95.7942
Sell,ORCL,Oracle Corporation ,85.606
Sell,PBCT,People's United Financial Inc. ,80.4976
Sell,PCLN,priceline.com Incorporated ,94.0242
Sell,PEG,Public Service Enterprise Group ,80.1325
Sell,PFG,Principal Financial Group Inc C ,87.2513
Sell,R,Ryder System Inc. Common ,94.6728
Sell,RF,Regions Financial Corporation C ,96.4646
Sell,RHT,Red Hat Inc. Common ,85.7813
Sell,RJF,Raymond James Financial Inc. C ,96.8788
Sell,SCHW,Charles Schwab Corporation (The ,89.5441
Sell,EA, Electronic Arts Inc. ,98.1252
Sell,FB, Facebook  Inc. ,87.4298
Sell,FITB, Fifth Third Bancorp ,85.9128
Sell,HBAN, Huntington Bancshares Incorpora ,90.0564
Sell,TRIP, TripAdvisor  Inc. ,91.4929
Sell,AAL,American Airlines Group Inc. ,80.6756
Sell,GOOGL,Alphabet Inc.,97.1108
Sell,CFG,Citizens Financial Group Inc.,81.4323
Sell,WBA,Walgreens Boots Alliance Inc.,86.2234
